No.     Time           Source                Destination           Protocol Length Info
      1 0.000000       62:8e:9a:77:18:64                           ARP      44     Who has 172.16.1.2? Tell 172.16.1.1

Frame 1: 44 bytes on wire (352 bits), 44 bytes captured (352 bits) on interface -, id 0
Linux cooked capture
Address Resolution Protocol (request)

No.     Time           Source                Destination           Protocol Length Info
      2 0.000014       3e:ab:33:55:10:c9                           ARP      44     172.16.1.2 is at 3e:ab:33:55:10:c9

Frame 2: 44 bytes on wire (352 bits), 44 bytes captured (352 bits) on interface -, id 0
Linux cooked capture
Address Resolution Protocol (reply)

No.     Time           Source                Destination           Protocol Length Info
      3 0.100610       172.16.1.1            172.16.1.2            ICMP     100    Echo (ping) request  id=0x1000, seq=0/0, ttl=64 (reply in 4)

Frame 3: 100 bytes on wire (800 bits), 100 bytes captured (800 bits) on interface -, id 0
Linux cooked capture
Internet Protocol Version 4, Src: 172.16.1.1, Dst: 172.16.1.2
Internet Control Message Protocol

No.     Time           Source                Destination           Protocol Length Info
      4 0.100618       172.16.1.2            172.16.1.1            ICMP     100    Echo (ping) reply    id=0x1000, seq=0/0, ttl=64 (request in 3)

Frame 4: 100 bytes on wire (800 bits), 100 bytes captured (800 bits) on interface -, id 0
Linux cooked capture
Internet Protocol Version 4, Src: 172.16.1.2, Dst: 172.16.1.1
Internet Control Message Protocol

No.     Time           Source                Destination           Protocol Length Info
      5 0.913823       172.16.1.1            172.16.1.2            ICMP     100    Echo (ping) request  id=0x1000, seq=1/256, ttl=64 (reply in 6)

Frame 5: 100 bytes on wire (800 bits), 100 bytes captured (800 bits) on interface -, id 0
Linux cooked capture
Internet Protocol Version 4, Src: 172.16.1.1, Dst: 172.16.1.2
Internet Control Message Protocol

No.     Time           Source                Destination           Protocol Length Info
      6 0.913831       172.16.1.2            172.16.1.1            ICMP     100    Echo (ping) reply    id=0x1000, seq=1/256, ttl=64 (request in 5)

Frame 6: 100 bytes on wire (800 bits), 100 bytes captured (800 bits) on interface -, id 0
Linux cooked capture
Internet Protocol Version 4, Src: 172.16.1.2, Dst: 172.16.1.1
Internet Control Message Protocol

No.     Time           Source                Destination           Protocol Length Info
      7 1.913013       172.16.1.1            172.16.1.2            ICMP     100    Echo (ping) request  id=0x1000, seq=2/512, ttl=64 (reply in 8)

Frame 7: 100 bytes on wire (800 bits), 100 bytes captured (800 bits) on interface -, id 0
Linux cooked capture
Internet Protocol Version 4, Src: 172.16.1.1, Dst: 172.16.1.2
Internet Control Message Protocol

No.     Time           Source                Destination           Protocol Length Info
      8 1.913020       172.16.1.2            172.16.1.1            ICMP     100    Echo (ping) reply    id=0x1000, seq=2/512, ttl=64 (request in 7)

Frame 8: 100 bytes on wire (800 bits), 100 bytes captured (800 bits) on interface -, id 0
Linux cooked capture
Internet Protocol Version 4, Src: 172.16.1.2, Dst: 172.16.1.1
Internet Control Message Protocol

No.     Time           Source                Destination           Protocol Length Info
      9 2.923517       172.16.1.1            172.16.1.2            ICMP     100    Echo (ping) request  id=0x1000, seq=3/768, ttl=64 (reply in 10)

Frame 9: 100 bytes on wire (800 bits), 100 bytes captured (800 bits) on interface -, id 0
Linux cooked capture
Internet Protocol Version 4, Src: 172.16.1.1, Dst: 172.16.1.2
Internet Control Message Protocol

No.     Time           Source                Destination           Protocol Length Info
     10 2.923528       172.16.1.2            172.16.1.1            ICMP     100    Echo (ping) reply    id=0x1000, seq=3/768, ttl=64 (request in 9)

Frame 10: 100 bytes on wire (800 bits), 100 bytes captured (800 bits) on interface -, id 0
Linux cooked capture
Internet Protocol Version 4, Src: 172.16.1.2, Dst: 172.16.1.1
Internet Control Message Protocol

No.     Time           Source                Destination           Protocol Length Info
     11 3.914460       172.16.1.1            172.16.1.2            ICMP     100    Echo (ping) request  id=0x1000, seq=4/1024, ttl=64 (reply in 12)

Frame 11: 100 bytes on wire (800 bits), 100 bytes captured (800 bits) on interface -, id 0
Linux cooked capture
Internet Protocol Version 4, Src: 172.16.1.1, Dst: 172.16.1.2
Internet Control Message Protocol

No.     Time           Source                Destination           Protocol Length Info
     12 3.914467       172.16.1.2            172.16.1.1            ICMP     100    Echo (ping) reply    id=0x1000, seq=4/1024, ttl=64 (request in 11)

Frame 12: 100 bytes on wire (800 bits), 100 bytes captured (800 bits) on interface -, id 0
Linux cooked capture
Internet Protocol Version 4, Src: 172.16.1.2, Dst: 172.16.1.1
Internet Control Message Protocol

No.     Time           Source                Destination           Protocol Length Info
     13 4.090081       172.16.1.1            172.16.1.2            TCP      76     34108 → 80 [SYN] Seq=0 Win=64240 Len=0 MSS=1460 SACK_PERM=1 TSval=1684019392 TSecr=0 WS=128

Frame 13: 76 bytes on wire (608 bits), 76 bytes captured (608 bits) on interface -, id 0
Linux cooked capture
Internet Protocol Version 4, Src: 172.16.1.1, Dst: 172.16.1.2
Transmission Control Protocol, Src Port: 34108, Dst Port: 80, Seq: 0, Len: 0

No.     Time           Source                Destination           Protocol Length Info
     14 4.090091       172.16.1.2            172.16.1.1            TCP      76     80 → 34108 [SYN, ACK] Seq=0 Ack=1 Win=65160 Len=0 MSS=1460 SACK_PERM=1 TSval=3280809661 TSecr=1684019392 WS=128

Frame 14: 76 bytes on wire (608 bits), 76 bytes captured (608 bits) on interface -, id 0
Linux cooked capture
Internet Protocol Version 4, Src: 172.16.1.2, Dst: 172.16.1.1
Transmission Control Protocol, Src Port: 80, Dst Port: 34108, Seq: 0, Ack: 1, Len: 0

No.     Time           Source                Destination           Protocol Length Info
     15 4.103395       172.16.1.1            172.16.1.2            TCP      68     34108 → 80 [ACK] Seq=1 Ack=1 Win=64256 Len=0 TSval=1684019403 TSecr=3280809661

Frame 15: 68 bytes on wire (544 bits), 68 bytes captured (544 bits) on interface -, id 0
Linux cooked capture
Internet Protocol Version 4, Src: 172.16.1.1, Dst: 172.16.1.2
Transmission Control Protocol, Src Port: 34108, Dst Port: 80, Seq: 1, Ack: 1, Len: 0

No.     Time           Source                Destination           Protocol Length Info
     16 4.103432       172.16.1.1            172.16.1.2            HTTP     144    GET / HTTP/1.1 

Frame 16: 144 bytes on wire (1152 bits), 144 bytes captured (1152 bits) on interface -, id 0
Linux cooked capture
Internet Protocol Version 4, Src: 172.16.1.1, Dst: 172.16.1.2
Transmission Control Protocol, Src Port: 34108, Dst Port: 80, Seq: 1, Ack: 1, Len: 76
Hypertext Transfer Protocol

No.     Time           Source                Destination           Protocol Length Info
     17 4.103441       172.16.1.2            172.16.1.1            TCP      68     80 → 34108 [ACK] Seq=1 Ack=77 Win=65152 Len=0 TSval=3280809675 TSecr=1684019403

Frame 17: 68 bytes on wire (544 bits), 68 bytes captured (544 bits) on interface -, id 0
Linux cooked capture
Internet Protocol Version 4, Src: 172.16.1.2, Dst: 172.16.1.1
Transmission Control Protocol, Src Port: 80, Dst Port: 34108, Seq: 1, Ack: 77, Len: 0

No.     Time           Source                Destination           Protocol Length Info
     18 4.218651       172.16.1.2            172.16.1.1            TCP      300    80 → 34108 [PSH, ACK] Seq=1 Ack=77 Win=65152 Len=232 TSval=3280809790 TSecr=1684019403 [TCP segment of a reassembled PDU]

Frame 18: 300 bytes on wire (2400 bits), 300 bytes captured (2400 bits) on interface -, id 0
Linux cooked capture
Internet Protocol Version 4, Src: 172.16.1.2, Dst: 172.16.1.1
Transmission Control Protocol, Src Port: 80, Dst Port: 34108, Seq: 1, Ack: 77, Len: 232

No.     Time           Source                Destination           Protocol Length Info
     19 4.224748       172.16.1.2            172.16.1.1            HTTP     180    HTTP/1.1 200 OK  (text/html)

Frame 19: 180 bytes on wire (1440 bits), 180 bytes captured (1440 bits) on interface -, id 0
Linux cooked capture
Internet Protocol Version 4, Src: 172.16.1.2, Dst: 172.16.1.1
Transmission Control Protocol, Src Port: 80, Dst Port: 34108, Seq: 233, Ack: 77, Len: 112
[2 Reassembled TCP Segments (344 bytes): #18(232), #19(112)]
Hypertext Transfer Protocol
Line-based text data: text/html (6 lines)

No.     Time           Source                Destination           Protocol Length Info
     20 4.260893       172.16.1.2            172.16.1.1            TCP      180    [TCP Retransmission] 80 → 34108 [FIN, PSH, ACK] Seq=233 Ack=77 Win=65152 Len=112 TSval=3280809832 TSecr=1684019403

Frame 20: 180 bytes on wire (1440 bits), 180 bytes captured (1440 bits) on interface -, id 0
Linux cooked capture
Internet Protocol Version 4, Src: 172.16.1.2, Dst: 172.16.1.1
Transmission Control Protocol, Src Port: 80, Dst Port: 34108, Seq: 233, Ack: 77, Len: 112

No.     Time           Source                Destination           Protocol Length Info
     21 4.282136       172.16.1.1            172.16.1.2            TCP      68     34108 → 80 [ACK] Seq=77 Ack=233 Win=64128 Len=0 TSval=1684019533 TSecr=3280809790

Frame 21: 68 bytes on wire (544 bits), 68 bytes captured (544 bits) on interface -, id 0
Linux cooked capture
Internet Protocol Version 4, Src: 172.16.1.1, Dst: 172.16.1.2
Transmission Control Protocol, Src Port: 34108, Dst Port: 80, Seq: 77, Ack: 233, Len: 0

No.     Time           Source                Destination           Protocol Length Info
     22 4.292330       172.16.1.1            172.16.1.2            TCP      68     34108 → 80 [FIN, ACK] Seq=77 Ack=346 Win=64128 Len=0 TSval=1684019590 TSecr=3280809796

Frame 22: 68 bytes on wire (544 bits), 68 bytes captured (544 bits) on interface -, id 0
Linux cooked capture
Internet Protocol Version 4, Src: 172.16.1.1, Dst: 172.16.1.2
Transmission Control Protocol, Src Port: 34108, Dst Port: 80, Seq: 77, Ack: 346, Len: 0

No.     Time           Source                Destination           Protocol Length Info
     23 4.292337       172.16.1.2            172.16.1.1            TCP      68     80 → 34108 [ACK] Seq=346 Ack=78 Win=65152 Len=0 TSval=3280809863 TSecr=1684019590

Frame 23: 68 bytes on wire (544 bits), 68 bytes captured (544 bits) on interface -, id 0
Linux cooked capture
Internet Protocol Version 4, Src: 172.16.1.2, Dst: 172.16.1.1
Transmission Control Protocol, Src Port: 80, Dst Port: 34108, Seq: 346, Ack: 78, Len: 0

No.     Time           Source                Destination           Protocol Length Info
     24 4.292341       172.16.1.1            172.16.1.2            TCP      80     [TCP Dup ACK 22#1] 34108 → 80 [ACK] Seq=78 Ack=346 Win=64128 Len=0 TSval=1684019590 TSecr=3280809832 SLE=233 SRE=346

Frame 24: 80 bytes on wire (640 bits), 80 bytes captured (640 bits) on interface -, id 0
Linux cooked capture
Internet Protocol Version 4, Src: 172.16.1.1, Dst: 172.16.1.2
Transmission Control Protocol, Src Port: 34108, Dst Port: 80, Seq: 78, Ack: 346, Len: 0

No.     Time           Source                Destination           Protocol Length Info
     25 235.296901     fe80::3cab:33ff:fe55:10c9 ff02::2               ICMPv6   72     Router Solicitation from 3e:ab:33:55:10:c9

Frame 25: 72 bytes on wire (576 bits), 72 bytes captured (576 bits) on interface -, id 0
Linux cooked capture
Internet Protocol Version 6, Src: fe80::3cab:33ff:fe55:10c9, Dst: ff02::2
Internet Control Message Protocol v6
